{
  "schema_version": "1.0",
  "brand_id": "calapres",
  "idempotency_key": "bbbbbbbbbbbbbbbbbbbbbbbbbbbbbbbbbbbbbbbbbbbbbbbbbbbbbbbbbbbbbbbb",
  "delivery_fingerprint": "cccccccccccccccccccccccccccccccccccccccccccccccccccccccccccccccc",
  "correlation_id": "calapres:synthetic:003",
  "state": "claimed",
  "first_seen_at": "2026-08-11T12:03:00+03:00",
  "last_seen_at": "2026-08-11T12:03:00+03:00",
  "expires_at": "2026-08-18T12:03:00+03:00"
}
